{
  "definitions": {},
  "$schema": "http://json-schema.org/draft-07/schema#",
  "$id": "http://example.com/root.json",
  "type": "array",
  "title": "The Root Schema",
  "items": {
    "$id": "#/items",
    "type": "object",
    "title": "The Items Schema",
    "required": [
      "visitId",
      "personId",
      "conceptId",
      "startDate",
      "startDatePrecision",
      "endDate",
      "endDatePrecision",
      "title",
      "subtitle",
      "careSiteId",
      "performingProviderId",
      "referringProviderId"
    ],
    "properties": {
      "visitId": {
        "$id": "#/items/properties/visitId",
        "type": "string",
        "title": "The Visitid Schema",
        "default": "",
        "examples": [
          "dc2a52bf-e100-45a1-abec-9f68a7f50888"
        ],
        "pattern": "^(.*)$"
      },
      "personId": {
        "$id": "#/items/properties/personId",
        "type": "string",
        "title": "The Personid Schema",
        "default": "",
        "examples": [
          "81163710-c2a2-4750-8e7f-8c7e18575695"
        ],
        "pattern": "^(.*)$"
      },
      "conceptId": {
        "$id": "#/items/properties/conceptId",
        "type": "string",
        "title": "The Conceptid Schema",
        "default": "",
        "examples": [
          "37d63769-cfc5-563e-87cd-49f0e3c5b034"
        ],
        "pattern": "^(.*)$"
      },
      "startDate": {
        "$id": "#/items/properties/startDate",
        "type": "string",
        "title": "The Startdate Schema",
        "default": "",
        "examples": [
          "2008-02-26T12:00:00"
        ],
        "pattern": "^(.*)$"
      },
      "startDatePrecision": {
        "$id": "#/items/properties/startDatePrecision",
        "type": "string",
        "title": "The Startdateprecision Schema",
        "default": "",
        "examples": [
          "DAY"
        ],
        "pattern": "^(.*)$"
      },
      "endDate": {
        "$id": "#/items/properties/endDate",
        "type": "string",
        "title": "The Enddate Schema",
        "default": "",
        "examples": [
          ""
        ],
        "pattern": "^(.*)$"
      },
      "endDatePrecision": {
        "$id": "#/items/properties/endDatePrecision",
        "type": "string",
        "title": "The Enddateprecision Schema",
        "default": "",
        "examples": [
          ""
        ],
        "pattern": "^(.*)$"
      },
      "title": {
        "$id": "#/items/properties/title",
        "type": "string",
        "title": "The Title Schema",
        "default": "",
        "examples": [
          "Right Comprehensive Neck Dissection"
        ],
        "pattern": "^(.*)$"
      },
      "subtitle": {
        "$id": "#/items/properties/subtitle",
        "type": "string",
        "title": "The Subtitle Schema",
        "default": "",
        "examples": [
          ""
        ],
        "pattern": "^(.*)$"
      },
      "careSiteId": {
        "$id": "#/items/properties/careSiteId",
        "type": "string",
        "title": "The Caresiteid Schema",
        "default": "",
        "examples": [
          "3fa3ceab-4085-4033-86c6-c31f075df0d8"
        ],
        "pattern": "^(.*)$"
      },
      "performingProviderId": {
        "$id": "#/items/properties/performingProviderId",
        "type": "string",
        "title": "The Performingproviderid Schema",
        "default": "",
        "examples": [
          "c39b2081-23ae-489f-b1aa-9168926ae522"
        ],
        "pattern": "^(.*)$"
      },
      "referringProviderId": {
        "$id": "#/items/properties/referringProviderId",
        "type": "string",
        "title": "The Referringproviderid Schema",
        "default": "",
        "examples": [
          ""
        ],
        "pattern": "^(.*)$"
      }
    }
  }
}